TIME,INDIC_UR_LAB,CITIES_LAB,INFO_LAB,INDICATORS,INDICATORS_VALUE
1989_1993,"Total population in Urban Audit cities","Worcester","Value",OBS_VALUE,83300
1994_1998,"Total population in Urban Audit cities","Worcester","Value",OBS_VALUE,90400
1999_2002,"Total population in Urban Audit cities","Worcester","Value",OBS_VALUE,93372
1999_2002,"Proportion of journeys to work by bicycle","Worcester","Value",OBS_VALUE,1.6
1999_2002,"Proportion of journeys to work by foot","Worcester","Value",OBS_VALUE,2.3
1999_2002,"Proportion of journeys to work by public transport (rail, metro, bus, tram)","Worcester","Value",OBS_VALUE,6.6
1999_2002,"Proportion of journeys to work by car or motor cycle","Worcester","Value",OBS_VALUE,73.6
2003_2006,"Total population in Urban Audit cities","Worcester","Value",OBS_VALUE,93600

